,claim,claim_veracity
4468,Shortage of personal protective equipment endangering health workers worldwide,1
4469,"IPA, WHO and UNICEF launch Read the World on International Childrens Book Day to support children and young people in isolation",1
4470,One World: Together At Home Global Special,1
4471,Statement of the Twenty-Fourth IHR Emergency Committee,1
4472,"WHO partners with WhatsApp, Facebook and Viber to bring most up to date and accurate information to billions of people",1
4473,World experts and funders set priorities for COVID-19 research,1
4474,Scaling up coronavirus outbreak readiness in Ethiopia and across Africa,1
4475,WHO continues to support the fight against coronavirus in Syria,1
4476,WHO works with countries from the South-East Asia Region,1
4477,#BeActive for the UN International Day of Sport for Development and Peace,1
4478,WHO supports fight to contain COVID-19 in Iraq,1
4479,World TB Day 2020 Newsletter,1
4480,WHO and partners call for urgent investment in nurses,1
4481,#ThanksHealthHeros - World Health Day Message,1
4482,New WHO recommendations to prevent tuberculosis aim to save millions of lives,1
4483,"Meeting Postponement: Preparing Together: Keeping the World Safe, Protecting Economies, Connecting Nations",1
4484,Statement on the 5th meeting of the International Health Regulations (2005) Emergency Committee for Ebola virus disease in the Democratic Republic of the Congo on 14 April 2020,1
4485,WHO Director-Generals Statement on IHR Emergency Committee on Ebola Virus Disease in the Democratic Republic of the Congo,1
4486,"World Health Worker Week - April 5 - 11, 2020",1
4487,New Ebola case confirmed in the Democratic Republic of the Congo,1
4488,World Tuberculosis Day 2020,1
4489,Seventh advanced course on health financing for universal coverage for low- and middle-income countries,1
4490,Strengthening accountability to end TB,1
4491,WHO deploys rapid response teams to Italy,1
4492,World TB Day 2020: Its Time for solidarity,1
4493,"End in sight, but flare-ups likely in the Ebola outbreak in the Democratic Republic of the Congo",1
4494,WHO and Iraq: Stepping up detection and response,1
4495,World Blood Donor Day 2020,1
4496,Eradicating dracunculiasis: Ethiopia investigates six suspected human cases in Gambella region,1
4497,NC absentee ballots require 2 witnesses. Is that unique?,1
4498,"Virginia lags in coronavirus testing, as Mayor LeVar Stoney says",1
4499,Joe Biden says Trump admin isnt doing enough to protect workers from COVID-19,1
4500,"Still going in to work in Pennsylvania? Chances are, you're a low-wage worker, data show",1
4501,Cuomo accurately says that other countries that reopened saw an increase in coronavirus infections,1
4502,"Yes, Africans are being evicted in China amid fear of second COVID-19 wave",1
4503,Obama knocks GOPs stance on preexisting conditions during pandemic,1
4504,"Louisiana governor is right, there was no suggestion Mardi Gras had to be canceled",1
4505,Image of overcrowded NYC subway car is real,1
4506,"Yes, US shipped donated personal protective equipment to China in February",1
4507,Will homemade masks stop coronavirus from spreading? Fact-checking Sen. Pat Toomeys claim,1
4508,Did FDA regulations slow testing for the coronavirus?,1
4509,Cuomo correctly says no quarantine without state approval,1
4510,Most NC legislators in 'high risk age group' for coronavirus,1
4511,Internet providers offer free internet amid coronavirus shutdowns,1
4512,How the Utah Jazz got 58 coronavirus tests when US testing is sluggish,1
4513,"In Italy, people must stay home except for work or emergencies",1
4514,"Yes, San Francisco residents formed Anti-Mask League during 1918 flu",1
4515,"Are stay-at-home orders 'laws,' as Jay Inslee said?",1
4516,What the 1918 flu pandemic shows us about social distancing,1
4517,Fact-checking posts about mass graves in NYC,1
4518,"In coronavirus relief effort, Congress fell short on paid sick leave",1
4519,LA County sheriffs deputies arrested a paddle boarder for violating the states stay-at-home order,1
4520,"For now, Texas among states with lowest coronavirus death rate",1
4521,Study now says Wis. coronavirus cases will peak April 26. But thats not the date that went viral.,1
4522,Some fast-food chains turn away truckers at drive-thru windows. One has offered a solution,1
4523,Bill Gates warned in 2015 that we were unprepared for an infectious virus,1
4524,Trump campaign ad is mostly right on provisions in Pelosis coronavirus bill,1
4525,Did Pritzker lack authority to postpone the Illinois primary?,1
4526,"Yes, Wisconsin is the only state where all Republicans opposed coronavirus bill",1
4527,"Novel coronavirus could live up to 3 days, depending on the surface",1
4528,"Are 80 percent of coronavirus cases ""mild?""",1
4529,Fact-checking Trump campaign claim on Bidens 2009 swine flu comments,1
4530,Lou Dobbs says United States screening fewer people for coronavirus than other countries,1
4531,Checking tweet about Chinese people detained with flu-like symptoms,1
4532,A face mask exempt card shared on social media invokes the Americans with Disabilities Act and claims to excuse people from wearing face masks.,0
4533,A test on video with a gas detector shows that face masks result in dangerous oxygen levels for the wearer.,0
4534,A painting depicting children in face masks was created as a mural for the Denver airport in 1994 proving the COVID-19 pandemic was planned.,0
4535,According to Bill Gates the COVID-19 RNA vaccine will permanently alter our DNA. RNA vaccines can also cause autoimmunity.,0
4536,Meme shows Florida Surgeon General saying: Everyone should STOP wearing masks as they have now been found to be harmful to your health.,0
4537,Alexandria Ocasio-Cortez tweeted Its vital that Governors maintain restrictions on businesses until after the November Elections because economic recovery will help Trump be re-elected. A few business closures or job losses is a small price to pay to be free from his presidency. #KeepUsClosed.,0
4538,COVID-19 cases are up only because of our big number testing in the United States.,0
4539,If you are licensed to carry a concealed weapon wearing a face covering for coronavirus removes your conceal carry ability.,0
4540,Claim that Rep. Alexandria Ocasio-Cortez tweeted that U.S. governors should extend COVID-19 restrictions on businesses until after the November Elections.,0
4541,In North Carolina you can be charged with a class H felony for wearing a mask and concealed carrying.,0
4542,A face mask exempt card allows you to cite the ADA and not wear a mask.,0
4543,A scientific study shows that cannabis is more effective at preventing and treating COVID-19 than hydroxychloroquine.,0
4544,A short portion of an interview given by discredited researcher Judy Mikovits in which she claims that a vaccine for COVID-19 will be deadly warns against immunization and advocates for a five-year moratorium to test all vaccines has been watched tens of thousands of times on YouTube and Facebook.,0
4545,Social media posts shared thousands of times in the United States contain multiple false or misleading claims about face masks used to stop the spread of COVID-19,0
4546,Joe Biden and the Democrats want to prosecute Americans for going to church but not for burning a church.,0
4547,The U.S. Occupational Safety and Health Administration (OSHA) says masks dont work and violate OSHA oxygen levels.,0
4548,Gov. Gavin Newsom has no legal authority to make wearing face coverings mandatory in California.,0
4549,President Trumps claim that he inherited no ventilators from the Obama administration.,0
4550,OSHA says masks dont work to reduce COVID-19 transmission and violate OSHA oxygen levels.,0
4551,Bill Gates who has led harmful vaccination campaigns in developing countries now plans to use COVID-19 vaccines to surveil the population.,0
4552,If we stopped testing right now wed have very few cases if any.,0
4553,News stories referencing the number 322 and COVID-19 are proof cases tolls are being synchronized.,0
4554,In a very real sense (Oklahoma has) flattened the curve.  The number of cases in Oklahoma  its declined precipitously.,0
4555,FREE HORSES!!!! 52 thoroughbred horses need homes. Will go to Sugarcreek this Sat. for slaughter. Gentleman died due to COVID-19 and his son wants nothing to do with them.,0
4556,George Floyds murder filmed before COVID-19.,0
4557,Six months before the COVID plandemic Bill Gates had negotiated a $100 billion contact tracing deal with (the) Democratic congressman sponsor of bill.,0
4558,Gov. of Wisconsin Tony Evers removed the American flag from the Capitol building.,0
4559,Corona Virus claims a black belt. Chuck Norris Dead at 80.,0
4560,The biological lab in Wuhan where the COVID-19 virus was created was funded by President Barak Hussein Obama in 2015 to the tune of $3800000 American dollars.,0
4561,A Facebook post shared more than 25000 times says face masks should only be worn by medical professionals or people who have become ill during the coronavirus pandemic.,0
4562,Claim that Sarah Huckabee Sanders tweeted Its odd that the ANTIFA insurgency happened just as COVID-19 loses steam Its odd that COVID-19 happened the moment impeachment failed. Its odd that impeachment happened the moment Russian hoax failed. The Russian hoax happened because Hillary lost? Notice the pattern?,0
4563,The CDC just confirmed a 0.2% death-rate for COVID19.,0
4564,CNBC reported that Coronavirus patients without symptoms arent driving the spread of the virus based on remarks by a WHO official at a press briefing on 8 June 2020.,0
4565,Wearing masks for the coronavirus decreases oxygen intake increases toxin inhalation shuts down immune system increases virus risk scientifically inaccurate effectiveness not studied.,0
4566,The WHO stated that asymptomatic spread of COVID-19 is very rare therefore physical distancing and face masks are not necessary.,0
4567,A Colorado bill is removing exemptions for parents who dont want to vaccinate their children in order to attend school.,0
4568,Facebook posts shared thousands of times claim the coronavirus pandemic is a cover for a Gates Foundation-funded effort to implant microchips when patients noses or throats are swabbed during COVID-19 testing.,0
4569,N95 masks block few if any COVID-19 particles due to their size.,0
4570,Bill Gates coronavirus vaccine developed by Oxford researchers caused all test subjects to get coronavirus.,0
4571,A meme shared thousands of times on Facebook claims people can suffer from reduced oxygen to their blood and brain possibly leading to death if they wear a disposable mask for too long.,0
4572,A report drafted by a scientific panel appointed by Germanys Interior Ministry declaring the COVID-19 pandemic is a global false alarm was leaked by a former employee.,0
4573,Shes just casually carrying a body with 1 hand..? Sure.. More evidence of coronavirus being a complete hoax with props & street theater.,0
4574,A video has been shared thousands of times on social media claiming that circuit boards with COV-19 inscribed on them are being fitted to 5G towers.,0
4575,How many of you are aware that the female governor of Michigan is the niece of George Soros?,0
4576,Wearing a face mask caused a 19-year-old grocery store worker to be hospitalized for an lung infection due to breathing in her own carbon dioxide and bacteria.,0
4577,A study by Bartomeu Payeras i Cifre shows a direct correlation between 5G networks and COVID-19 outbreaks and demonstrates clearly the most likely probability that the COVID-19 hypoxic injuries and hospital admissions are directly related to electromagnetic radiation exposure by 5G networks.,0
4578,According to the CDC so far this year Florida has had 1762 deaths from COVID-19 and 5185 from pneumonia. Average pneumonia deaths in Florida from 2013-2018 for the same time period are 918.,0
4579,Were down near the low end of per capita deaths  Most places are at 60 deaths per 100000. Were at 29.,0
4580,Says the state health secretary says dont go to hospitals or clinics now the tourism secretary says dont recreate.,0
4581,An image shared on social media claims vaccines are dangerous because they contain potassium chloride the chemical used to stop the heart in lethal injections.,0
4582,Italy went against the WHOs law against COVID-19 autopsies and discovered covid is not a virus but a bacterium that clots the blood and reduces the oxygen saturation.,0
4583,You see suicide rates are skyrocketing now in the United States.,0
4584,[U.S. Rep. Conor Lamb] said he would NOT vote for [Nancy Pelosi] for Speaker and did.,0
4585,Autopsies performed in Italy showed that COVID-19 is not pneumonia but a blood clotting disorder (disseminated intravascular coagulation). Doctors have been treating COVID-19 wrongly because ventilators and intensive care units were never needed; COVID-19 should instead be treated with antibiotics anti-inflammatories and anticoagulants.,0
4586,COVID-19 is a bacterium that is easily treated with aspirin or a coagulant.,0
4587,A study of 455 contacts of an asymptomatic carrier showed that none of the 455 were infected. The results prove that asymptomatic people cannot transmit COVID-19 and masks are therefore unnecessary. Some also claim that this shows COVID-19 is not contagious.,0
4588,A photo shows Gov. Gretchen Whitmer on Mackinaw Island today ignoring mask and social distancing rules.,0
4589,President Donald Trump tweeted Some oldies will have to die. Were in Gods hands folks! Liberate America!,0
4590,Dolores Cahill claims in an interview on TheHighWire that there is already a preventive strategy and treatment for COVID-19 through nutrition vitamins and hydroxychloroquine therefore social distancing is unnecessary.,0
4591,A photo shows three men on crosses who feel like theyre being crucified by being required to stay at home.,0
4592,Japanese Nobel laureate Dr. Tasuku Honjo said the new coronavirus was engineered in a Chinese laboratory.,0
4593,Myrtle Beach South Carolina reported 220000 new coronavirus cases in 72 hours.,0
4594,Why did the state do that with COVID patients in nursing homes? Its because the state followed President Trumps CDC guidance.,0
4595,Michigan Gov. Gretchen Whitmers family spent May 20 at her second home breaking her own stay-at-home orders.,0
4596,Top White House coronavirus adviser Dr. Anthony Fauci served on the Clinton Foundations board of directors for 20 years.,0
4597,Michigan governor reopened Traverse City so she could have her daughters open house.,0
4598,The image shows Los Angeles County Department of Public Health Director Dr. Barbara Ferrer looking sickly.,0
4599,People who have received flu vaccines in the past three to five years will probably test positive for COVID-19.,0
4600,Bill Gates Explains That The COVID Vaccine Will Use Experimental Technology And Permanently Alter Your DNA.,0
4601,Dr. Anthony Fauci said: as soon as a COVID-19 vaccine is manufactured it must be delivered to healthcare professionals for immediate human injection. Proper studies can be done later.,0
4602,President Donald Trump cancelled the U.S. House bill on contract tracing and expelled WHO.,0
4603,The German government billed China for 130 billion pounds in coronavirus damages.,0
4604,House Speaker Nancy Pelosi was in Wuhan China six days after the impeachment HOAX failed.,0
4605,If you look at the one (hydroxychloroquine) survey the only bad survey they were giving it to people that were in very bad shape. They were very old. Almost dead.,0
4606,The new Dane County lockdown policy (has) effectively killed Badger football hockey and basketball for 2020.,0
4607,A lot of people can get an additional $2400 from the CARES Act and they can do it every month!,0
4608,Claim that President Donald Trump is trying to make $451 billion in Medicare cuts in the middle of a deadly pandemic.,0
4609,The World Health Organization (WHO) said that no vegetarian has contracted COVID-19.,0
4610,Texas and Florida have a balanced budget while California is in debt $54 billion and New York is in debt $6.1 billion.,0
4611,UV-C lamps can kill 99.99% of all bacteria viruses and mold on any surface in ten seconds yet is 100% safe for humans and pets.,0
4612,Children in Oregon may be taken away if their parent or legal guardian tests positive for COVID-19.,0
4613,The video shows people celebrating the end of Saudi Arabias coronavirus lockdown.,0
4614,Dolores Cahill in Computing Forever interview claims that taking vitamins C and D as well as zinc boosts the immune system against COVID-19 that hydroxychloroquine has been proven effective against COVID-19 and that COVID-19 patients who recover are immune for life among others.,0
4615,New evidence shows wearing a face mask can help coronavirus enter the brain and pose more health risk.,0
4616,An article claims that a nearly $50 million United Nations humanitarian aid package to Ecuador is conditional on the South American country legalizing abortions.,0
4617,While California is dying  Gavin (Newsom) is vacationing in Stevensville MT!,0
4618,The flu didnt kill any Americans this year.,0
4619,Says a warning label on a box of disposable masks shows that they are ineffective at protecting against the spread of COVID-19.,0
4620,Ohio Gov. Mike DeWine released 4300 prisoners and is now warning residents of a possible crime wave.,0
4621,Video shows Dr. Anthony Fauci advising the public not to wear face masks to prevent spreading or being infected by the coronavirus.,0
4622,Candace Owens claimed that the U.S. is not losing tons more lives in 2020 compared to 2019 and that the increase [in mortality in 2020 is] virtually non-existent.,0
4623,A Facebook post shared 10000 times claims no Americans died from the flu in 2020 suggesting that the national count of COVID-19 fatalities is exaggerated.,0
4624,The novel coronavirus was man-made.,0
4625,Posts shared thousands of times on social media list a number of adverse health effects linked to wearing face masks.,0
4627,Italian Parliament Calls For The Arrest of Bill Gates,0
4628,If masks prevent coronavirus governors would have given them to prison inmates instead of releasing them.,0
4629,Hydroxychloroquine cures this virus. It just so happens this is the treatment used for radiation sickness!!,0
4630,A Facebook post shared thousands of times claims the US Centers for Disease Control and Prevention lied about the number of deaths caused by COVID-19 by combining the count with pneumonia and influenza fatalities.,0
4631,Research proves that commercial mouthwash could protect against COVID-19.,0
4632,Telecommunications worker exposed circuit boards being installed in 5G towers bearing markings that read COV-19.,0
4633,A post on Facebook criticizes the effectiveness of face masks in protecting the wearer from COVID-19 the disease caused by the novel coronavirus.,0
4634,Cannabis may stop coronavirus from infecting people study finds.,0
4635,Claims made in the viral video Plandemic include: that the virus was manipulated in a laboratory setting; that hydroxychloroquine is effective against these families of viruses and that wearing a mask activates the virus.,0
4636,The photo shows Microsoft co-founder Bill Gates and top White House coronavirus adviser Dr. Anthony Fauci violating social distancing guidelines.,0
4637,The photo shows former Vice President Joe Biden and Michigan Gov. Gretchen Whitmer violating social distancing guidelines on April 9.,0
4638,The photo shows a letter purportedly from the California Department of Social Services that mandates coronavirus testing for participants of state assistance programs and warns that children may be removed from the household if someone tests positive.,0
4639,Says Nancy Pelosi tried once again to include abortion funding in the latest coronavirus bill.,0
4640,Due to the large number of people who will refuse the forthcoming COVID-19 vaccine because it will include tracking microchips the Gates Foundation is now spending billions to ensure that all medical and dental injections and procedures include the chips.,0
4641,If COVID-19 was a serious illness it would have wiped out the homeless population in the U.S.,0
4642,Vaccines are in direct violation of The Nuremberg Code.,0
4643,Anthony Fauci was on the Clinton Foundation board for 20 years and currently serves on Gates Foundation.,0
4644,Wisconsin Governor Tony Evers administration deemed dentists non-essential.,0
4645,$100B contact tracing bill is about controlling/tracking population not about coronavirus.,0
4646,United States the only country on Earth that is protesting being on lockdown amid the coronavirus outbreak.,0
4647,The U.S. is the only country on earth that is protesting being locked down.,0
4648,Police violently forced a family from their home in the U.S. in handcuffs because they were in violation of House Resolution 6666.,0
4649,Clearly the Obama administration did not leave any kind of game plan for something like this.,0
4650,The video shows the bodies of deceased COVID-19 victims washing ashore after some countries dumped them in the sea.,0
4651,White South Africans have been banned from receiving government aid during the coronavirus pandemic.,0
4652,President Donald Trump implemented a travel ban that just didnt work 400000 people got in from those countries that were subject to the restrictions.,0
4653,Vice President Mike Pence was caught on a hot mic delivering empty boxes of personal protective equipment (PPE) to a Virginia health care center.,0
4654,President Trump posted a tweet blaming President Obama for failing to prepare him for a pandemic and celebrating that there are still more people alive than dead.,0
4655,An article that has been widely shared on social media warns healthy people against wearing face masks during the COVID-19 pandemic citing alleged risks,0
4656,Plandemic  a slickly-edited 26-minute interview with a discredited researcher  has been widely shared on social media.,0
4657,A U.S. House bill would give government the power to forcibly take your family members from your home and quarantine them.,0
4658,Senate Majority leader Mitch Connell said the Obama administration left no game plan for a pandemic.,0
4659,Autopsies prove that COVID-19 is a blood clot not pneumonia and ought to be fought with antibiotics and the whole world has been wrong in treating the so-called pandemic.,0
4660,Germany and the United States are the two best in deaths per 100000 people which frankly to me thats perhaps the most important number there is.,0
4661,Nancy Pelosi said Congress shall not vote remotely because it is not secure! while also saying that Americans should all vote for president by mail!,0
4662,Dr. Anthony Fauci is pushing remdesivir as a potential COVID-19 treatment drug because he invented it with Bill Gates and they stand to profit from it.,0
4663,Barack Obama is the first ex-president to ever speak against his successor.,0
4664,This is what Bill Gates and George Soros want to do secretly stick you with a chip while testing you for the coronavirus the Dems have a bill on the House floor ready to vote on it to require this.,0
4665,House Resolution 6666 includes billions of dollars to fund forced quarantining for Americans who test positive for COVID-19.,0
4666,Under an 1866 Supreme Court ruling stay-at-home orders are illegal in the United States and can be disregarded with impunity.,0
4667,Guess what [children are] not at risk unless they have an underlying medical issue.,0
4668,American Vice-President Mike Pence was caught on a hot mic delivering empty boxes of PPE to a nursing home and pretended they were heavy.,0
4669,President Trump sent out a tweet that included the phrase Oldies will have to die in connection with lifting coronavirus restrictions.,0
4670,Australias COVIDSafe app tracks users locations.,0
4671,Madagascar has found a coronavirus medicine that can wipe out the virus at any stage within a period of six days.,0
4672,A video shows a Maasai tribe member in Kenya whipping people who violate the countrys curfew during the coronavirus pandemic.,0
4673,Says wearing face masks is more harmful to your health than going without one.,0
4674,The mainstream media pretended there was a deadly surge in COVID cases thanks to Wisconsinites voting.,0
4675,A card claiming to exempt the holder from wearing a face mask in public the real deal sanctioned by the government.,0
4676,U.S. Vice President Mike Pence delivered empty boxes of PPE to a hospital as a publicity stunt.,0
4677,Ventura County public health director say that the California county will be forcibly moving people infected with COVID-19 out of their homes into quarantine.,0
4678,Since the reopening of (the state of Georgia) weve seen our COVID rate skyrocket by 40%.,0
4679,Jimmy Kimmel tweeted a video which said VP Mike Pence carried empty PPE boxes.,0
4680,Dr. Fauci sat on Microsofts board of directors.,0
4681,The CDC has recommended mail in voting. Thats what this whole pandemic is about: the election!.,0
4682,States like New York Illinois and California have been vocal in their demands for funding to bail out their pension systems which were failing long before the COVID-19 outbreak and other programs that arent related to this crisis.,0
4683,A widely-circulated image claims to reveal the ingredients contained in this years flu shots. The alleged ingredients include mercury antifreeze phenol animal blood animal viruses and formaldehyde.,0
4684,The origin of the novel coronavirus was manipulated contain coronaviruses and masks can reinfect wearers.,0
4685,Gates Foundation stands to make nearly 31.5 billion on a coronavirus vaccine in U.K.,0
4686,A video shows British Prime Minister Boris Johnson serving journalists tea after recovering from COVID-19.,0
4687,$3 trillion for federal coronavirus stimulus packages is being borrowed basically from China.,0
4688,Viral video reveals there is a coronavirus vaccine patent owned by Bill Gates.,0
