,claim_veracity,claim,leven__score
0,half-true,When did the decline of coal start? It started when natural gas took off that started to begin in (President George W.) Bushs administration.,109.88888888888900
1,half-true,The economic turnaround started at the end of my term.,42.333333333333300
2,half-true,"I'm the only person on this stage who has worked actively just last year passing, along with Russ Feingold, some of the toughest ethics reform since Watergate.",136.125
3,half-true,"However, it took $19.5 million in Oregon Lottery funds for the Port of Newport to eventually land the new NOAA Marine Operations Center-Pacific.",118.625
4,half-true,"Since 2000, nearly 12 million Americans have slipped out of the middle class and into poverty.",72.125
5,half-true,"In this last election in November, ... 63 percent of the American people chose not to vote, ... 80 percent of young people, (and) 75 percent of low-income workers chose not to vote.",150.2
6,half-true,"Water rates in Manila, Philippines, were raised up to 845 percent when a subsidiary of the World Bank became a partial owner.",101.1
7,half-true,"Scott Walker favors cutting up to 350,000 families and children off health care.",59.666666666666700
8,half-true,Rick Perry has never lost an election and remains the only person to have won the Texas governorship three times in landslide elections.,110.5
9,half-true,Marco Rubio skipped 18 defense votes including one to arm the Kurds to fight ISIS.,66.5
10,half-true,African-American youth unemployment is 51 percent. Hispanic youth unemployment is 36 percent.,71.875
11,half-true,"In Georgia, women earn 82 cents for every dollar earned by men.",49.7
12,half-true,A federal system that verifies employees are authorized to work in the U.S. is inaccurate anywhere from 50 percent all the way up to in excess of 80 percent of the time.,147.2
13,half-true,I think it is unacceptable for the Chinese today to be larger in wind power and in solar panels and photovoltaic manufacturing than all of Europe put together -- forget the United States.,152.7
14,half-true,"At some point in their lives, 99% of women use birth control.",45.18181818181820
15,half-true,"In Rick Perrys Texas, we import nurses ... from other countries.",48.333333333333300
16,half-true,Mitt Romney Says a poll found him the only Republican candidate who could beat Barack Obama in Texas -- and by eight points.,100.77777777777800
17,half-true,"Since Gina Raimondo took office, investment fees on the states pension portfolio have gone up from about $12 million annually to about $50 million.",122.33333333333300
18,half-true,"Under President Barack Obamas jobs bill, states would no longer have to lay off teachers, firefighters and police officers.",95.0
19,half-true,"Under President Obamas health-care reforms, the premium for an average plan for a family didnt go down by $2,500 per year, its gone up about $2,500 per year.",126.875
20,half-true,"The IRS also investigated liberal groups, groups that had progressive in their name. ... The IRS was basically looking at everybody.",105.33333333333300
21,half-true,About 3 percent of murders and crimes are committed with guns from people who actually (legally) purchase those guns.,92.8
22,half-true,Donald Trump has said nuclear proliferation is OK.,38.77777777777780
23,half-true,The Arizona immigration law expressly bans racial profiling.,46.2
24,half-true,We (Democrats) have made steady progress creating jobs and improving our schools.,62.77777777777780
25,half-true,Ron Johnson calls Social Security a Ponzi scheme and wants to privatize the program.,55.77777777777780
26,half-true,"There are 31 other states and 10,000 other cities that have the same type of policies that we just passed, referring to North Carolinas House Bill 2.",123.125
27,half-true,While Sarah was Mayor of Wasilla she tried to fire our highly respected City Librarian because the Librarian refused to consider removing from the library some books that Sarah wanted removed.,162.9
28,half-true,"If Milwaukee approves reducing its maximum forfeiture for marijuana possession to $50, the city would have 23 different bicycle violations that have a higher forfeiture.",140.5
29,half-true,Chris Christie vetoed a jobs package of 30 bills.,37.666666666666700
30,half-true,Illinois gubernatorial candidate Bill Bradys first priority after winning the primary was to sponsor a bill that would mass-euthanize sheltered dogs and cats in gas chambers.,150.11111111111100
31,half-true,Barack Obama is in an economy thats only worsened since hes been president of the United States.,72.66666666666670
32,half-true,"New Jersey is down nearly 200,000 jobs from its pre-recession peak and with Gov. Chris Christie New Jersey has trailed the rest of America when it comes to unemployment for 12 consecutive months.",169.11111111111100
33,half-true,Gas prices have gone up $2 since Obama took office.,42.36363636363640
34,half-true,"Seniors with coverage under Medicare Advantage will give up ""more than their share"" because of health care reform",89.66666666666670
35,half-true,"Over 12,000 school kids were arrested in Florida. It makes Florida the nations leader in that area.",70.75
36,half-true,"Payday lenders profit from the poor by charging 1,000-plus percent interest.",57.6
37,half-true,"The Social Security trust fund is sound. Without anything being done, it would function well into 2038; and even after that time with no changes, we could pay 80 percent of the benefits that people have earned.",178.55555555555600
38,half-true,"Every single one of the 41 Republican senators who just blocked a raise in the minimum wage will receive a $2,800 cost-of-living adjustment on January 1, 2015.",130.5
39,half-true,"While our people work longer hours for lower wages, almost all new income goes to the top 1 percent.",80.1
40,half-true,"Rick Scott took $200,000 from a family that leased land for drilling and now he is trying to hide from it.",82.66666666666670
41,half-true,On how money from a possible lease of the Ohio Turnpike would be used,52.0
42,half-true,"The president has had 1,540 of his nominations confirmed, only four defeated.",57.875
43,half-true,One percent of the American people make over 21 percent of all the income in America. That wasnt the way before George Bush became president.,117.11111111111100
44,half-true,"Military ""recruiting went on at Harvard every single day throughout the time (Kagan) was there.""",73.5
45,half-true,"David Perdue wants to abolish the U.S. Department of Education, which would cost Georgia schools $1 billion a year and eliminate millions in student loans.",131.0
46,half-true,The United States imprisons more than any nation in the world.,45.54545454545460
47,half-true,Hillary Clinton supported NAFTA and permanent China trade. Pennsylvania lost thousands of jobs.,71.77777777777780
48,half-true,Numerous studies have shown that these so-called right-to-work laws do not generate jobs and economic growth.,82.25
49,half-true,"President Barack Obama's ""initial response when we heard about the Christmas underwear bomber"" was to say that ""this was the act of an isolated extremist.""",123.0
50,half-true,"National Republican Senatorial Committee Says Sen. Sherrod Brown admitted that his $787 billion stimulus law failed and after specifically attacking Republicans for wanting to lower Americans taxes, (he) now claims that his stimulus bill didnt do enough to lower taxes.",239.125
51,half-true,Gov. Chris Christies proposal to reduce state income taxes would be the second tax cut for the rich by the governor in two years.,92.22222222222220
52,half-true,"Hypocrisy at the Clinton Foundation: Top male staff made on average $218,029 while top female staff made $153,014 from 2010-2014.",103.2
53,half-true,Rudy Giuliani Says federal law enforcement officers cut off questioning of the Christmas Day underwear bomber by giving him a Miranda warning after 30 minutes of questioning.,145.5
54,half-true,On legalizing illegal immigrants.,38.77777777777780
55,half-true,"We are ""borrowing Saudi money for Saudi oil"" with the result being ""dependency and debt.""",72.0
56,half-true,"There are homes for sale on and around (Oswego Lake) right now for under $150,000 that anyone is welcome to buy.",83.875
57,half-true,"Since the president became the president, we have lost 3.3 million jobs in the private sector. But you know whos done OK and whos not complaining today? The public sector. Weve gained 590,000 public sector jobs.",180.44444444444400
58,half-true,Chris Christie has not increased the taxes on anyone.,37.4
59,half-true,"Sen. Rob Portman said, It would be irresponsible not to cut Medicare.",54.77777777777780
60,half-true,"Washington, D.C., had some of the strictest gun laws in the country. And when they passed them, violence skyrocketed.",92.81818181818180
61,half-true,"Scott Walker wants to ban common forms of birth control, including the pill.",57.333333333333300
62,half-true,"Shelby County donated Im sorry, gave 44 schools to the city of Memphis.",54.375
63,half-true,"Top U.S. intelligence officials have toldevery member of Congress, including the president, were about to be attacked in a serious way because (of) the threat emanating from Syria and Iraq.",158.88888888888900
64,half-true,There are mechanisms in place to shut down the Internet privately.,49.44444444444440
65,half-true,Report that #GOP insisting on changes to Social Security as part of #fiscalcliff false. BTW those changes are supported by @barackobama.,107.25
66,half-true,"Rep. Paul Ryans Medicare plan lines the pockets of the private insurance companies, increases costs for seniors and does not reduce the deficit.",116.77777777777800
67,half-true,"For every $1 spent on afterschool programs, we can save over $5, almost $6, in crime costs down the line.",85.88888888888890
68,half-true,"The federal government has $3 trillion in cash flow, so we can pay our bills and wont default.",75.1
69,half-true,The STAR Ohio fund just received the highest possible credit rating one of these funds can receive.,80.8
70,half-true,"Taxpayers are on the hook ... for less than a third of the proposed new Atlanta Falcons stadium, and those funds are repaid from money that comes from outsiders.",132.1
71,half-true,"Every year, more than $40 million are leaving Missouri for the Lone Star State.",61.44444444444440
72,half-true,Recent international reports show the United States near the bottom among industrialized nations for k-12 academic achievement.,105.1
73,half-true,"The policy mistakes that ... the Clintons made got us, in large degree, to the situation that we are in today with mass incarceration.",104.11111111111100
74,half-true,They tried to give us $400 million to build a high-speed train that goes 39 miles an hour.,67.22222222222220
75,half-true,"The CBO estimates that fully extending the Bush tax cuts would add 600,000-1.4 million jobs in 2011 and 900,000-2.7 million jobs in 2012.",111.22222222222200
76,half-true,"According to David Cay Johnston, the average American pays about 22 percent of their income to federal taxes. The richest 400 Americans pay about 16 percent of their income to federal taxes.",161.33333333333300
77,half-true,"Last week the Texas State Board of Education (SBOE), led by Rick Perrys appointee, voted to remove Thomas Jefferson from social studies textbook standards. Thats right. Thomas Jefferson... was deleted from a list of historical figures who inspired political change.",231.88888888888900
78,half-true,"From 2013-2015, the richest 14 Americans increased their net wealth by more than $157 billion, yet the Republican budget would not require these Americans to contribute one penny to deficit reduction.",168.33333333333300
79,half-true,"While Foster was mayor, Rick Kriseman was ineffective in the Florida House of Representatives because there was no legislation that passed the House that had (Krisemans) name on it.",153.22222222222200
80,half-true,The Redskins Training Camp deal generated $40 million in new private investment in the city.,68.44444444444440
81,half-true,The GOP budget plan would cut nearly a million jobs.,42.44444444444440
82,half-true,There are more people living in this country who were not born here than at anytime in the history of the country.,88.77777777777780
83,half-true,Hillary Clinton defended Syrias President Assad as a possible reformer at the start of that countrys civil war.,86.875
84,half-true,"The Postal Services financial losses result from a 2006 law that drains $5 billion a year from post office revenue, while the Postal Service is forced to overpay billions more into federal accounts.",165.66666666666700
85,half-true,"Since Republicans took over after the 2010 election, the graduation rate in Wisconsin has gone from 86 percent to 88 percent. The black graduation rate has gone from 60 percent to 65 percent. The Latino graduation rate has gone from 65 percent to 71 percent.",225.44444444444400
86,half-true,"Since Rick Perry became governor, Texas has gone from 46th in the country to 50th in the population that graduates from high school.",107.375
87,half-true,The streetcar project planned by Mayor Tom Barrett would be a 1900s style trolley.,62.0
88,half-true,"Americans, in the last 30 years, have more than doubled the amount of money we are spending per child (on education) and the results have gotten worse, not better.",131.2
89,half-true,"Enacting the Right-to-Carry Act would amount to expanding the rights of sex offenders, terrorists, child predators, and abusers to carry concealed weapons across state lines.",143.71428571428600
90,half-true,"Nathan Deal cut the HOPE scholarship program so that literally 100,000 Georgians will not be able to go to college or get technical training that they so badly needed to raise -- you know, give them a chance at a good job.",192.75
91,half-true,"As governor of Arkansas, I cut taxes and fees almost 100 times, saving the taxpayers almost $380-million. I left a surplus of nearly $850-million.",124.625
92,half-true,I havent raised taxes in the time Ive been the governor of New Jersey.,55.666666666666700
93,half-true,Six people in Florida die as a result of (not expanding Medicaid) every day.,61.3
94,half-true,Groups that receive foreign money are spending huge sums to influence American elections.,67.22222222222220
95,half-true,"[A]t his current rate, President Obama will have added more debt to the United State of America by the end of his first term than each of the previous 43 presidents -- combined!",143.875
96,half-true,We know that Saudi Arabia started al-Qaida.,42.6
97,half-true,Democrats are kind of falling over each other seeing who can raise taxes faster. It looks like they're going to raise taxes anywhere between 20 to 30 percent.,135.44444444444400
98,half-true,"David Dewhurst Says he passed eight measures, including ones to prevent groping at airport security checks and to bar sanctuary cities in Texas.",115.5
99,half-true,"Dan Patrick said that if women get paid less than a man for the same job, that thats not a problem.",74.77777777777780
100,half-true,"Weve got an average of 5,600 soldiers committing suicide. Thats about 20 a day.",63.375
101,half-true,"Kim Myers voted repeatedly to raise taxes on the people of Broome County, but made millions off of tax savings when her family business relocated its headquarters.",136.875
102,half-true,"Californias Prop 60, which would requirecondom usein adult films, would put workers in the adult film industry at riskfor lawsuits and harassment.",115.0
103,half-true,"Sens. Isaksons, Chambliss Votes Against Unemployment Insurance Were Votes to Kill Nearly 6,000 Georgia Jobs.",83.57142857142860
104,half-true,Today unemployment has been running near 12 percent or more for the last four years and the Legislature hasnt done much to lower it.,104.3
105,half-true,John Mica voted to borrow $10 trillion.,37.625
106,half-true,"When terrorists killed more than 250 Americans in Lebanon under Ronald Reagan, the Democrats didnt make that a partisan issue.",101.125
107,half-true,The bulk of the people who are shot with a weapon other than these drug gangs taking on one another end up being shot with their own weapon.,115.6
108,half-true,Salaries for URI faculty are second to last among New England land grant universities and in lowest 20 percent of major U.S. research institutions,118.88888888888900
109,half-true,"Joseph Crowley Says Donald Trump cashed in on Sept. 11,collecting $150,000 in federal funds intended to help small businesses recover even though days after the attack Trump said his properties were not affected.",182.88888888888900
110,half-true,George Allen and his colleagues in the Senate turned the biggest surplus in the history of the United States into the biggest deficit in the history of the United States.,150.66666666666700
111,half-true,President Obama has cracked down on employers who are attracting undocumented immigrants and hiring them more than any previous president.,110.6
112,half-true,"I told the Congress 'thanks, but no thanks,' on that Bridge to Nowhere.",41.77777777777780
113,half-true,Unemployment has fallen from 10 percent during the presidents first year in office to 8.5 percent today.,80.28571428571430
114,half-true,"American voters remain steadfast in their support for immigration reform with a path to citizenship, with more than 70 percent who want to see reform passed this year.",134.7
115,half-true,Atlanta is the No. 1 trading point for sexual slavery in America. Between 100 and 200 girls are sold into slavery in Atlanta every month.,107.11111111111100
116,half-true,"According to a national survey, transit ridership among people age 16 to 34 increased 40 percent between 2001 and 2009.",96.3
117,half-true,Im the only (Republican)candidate that has actually reduced the size of government.,63.375
118,half-true,Cory Booker supports late-term and partial-birth abortion and opposes safety regulations.,63.25
119,half-true,"In the month of July alone, EU exports to South Korea increased by over 36 percent. A lot of that is our market share. Those are our farmers and our service providers who are suffering.",154.66666666666700
120,half-true,"As Virginia lost over 65,000 jobs, (Tim) Kaine put partisan ambitions first by serving as DNC chairman during the last year of his governorship.",121.22222222222200
121,half-true,The DNC says McCain flip-flopped on whether the Iraq War would be easy.,56.888888888888900
122,half-true,"Zack Space voted for budgets and debt, energy taxes and the stimulus, and we still lost more than 2.5 million jobs.",96.44444444444440
123,half-true,"In every ethics case that has resulted in a formal sanction, theres been an investigative subcommittee thats been established first.",108.42857142857100
124,half-true,99.97 percent of the kids live in poverty that attend Cleveland public schools.,60.5
125,half-true,"John Kitzhaber created 128,000 new jobs while governor.",44.714285714285700
126,half-true,"AARP is ""the largest reseller of insurance in the country"" and ""has a vested interest in seeing that the market for reselling supplemental insurance expands.""",128.125
127,half-true,Youre in more trouble if you leave your pet in the car than if you leave your child in the car.,68.1
128,half-true,What I have put forward does not add a penny to the debt.,45.0
129,half-true,The states have always defined marriage.,39.333333333333300
130,half-true,"John McCain ""opposed legislation to fund levees and flood control programs, which he considers pork.""",78.0
131,half-true,"Mitt Romneys pledged to protect (oil companies) record profits and their billions in special tax breaks, too.",83.33333333333330
132,half-true,The FCCs net neutrality policy includes whatis essentially a massive tax increase.,60.22222222222220
133,half-true,"In the United States, weve had 12 years in a row of wages declining.",51.666666666666700
134,half-true,Charlie Crist has six different positions on ObamaCare.,43.888888888888900
135,half-true,Weve created more jobs in the United States than every other advanced economy combined since I came into office.,85.77777777777780
136,half-true,"For the first time ever, we completely funded the critical needs waiting list so persons with unique abilities can get the help they need.",108.8
137,half-true,"Paul Ryan got his start in politics, as a young staffer just out of college, working for then-Congressman John Kasichs Budget Committee.",113.0
138,half-true,President Obama in November of last year wiped away (a program) that allows for shared fingerprinting for those who are behind bars so you know who is here legally and illegally.,146.11111111111100
139,half-true,The U.S. spends more money on its military than the 16 biggest military budgets in the world combined.,76.2
140,half-true,The Affordable Care Act is bringing the cost of health care in our country down.,55.1
141,half-true,"In 1929, the Secretary of State shut down a program that was collecting information to protect America because it was unseemly, but that move led to millions and millions of deaths in World War II.",169.55555555555600
142,half-true,The Chris Hani Baragwanath in South Africa is the worlds third-biggest hospital.,51.90909090909090
143,half-true,"Bill Nelson Says Connie Mack initially said he would have voted yes for the Paul Ryan budget plan, and then, you said it was stupid and you would vote no. And then your folks corrected you, and you changed your position again, yes.",203.77777777777800
144,half-true,"Hillary Clinton Says her campaign platform includes the biggest investment in new, good-paying jobs since World War II.",91.25
145,half-true,"Joe Biden brought Republicans and Democrats together to pass the 1994 crime bill, putting 100,000 cops on the streets and starting an eight-year drop in crime across the country.",142.8
146,half-true,Donald Trump has defended World War II internment camps.,36.5
147,half-true,Lee Leffingwell raised property taxes 20 percent in three years.,50.0
148,half-true,President Barack Obama was responsible for the assassination of at least four American citizens in drone strikes.,87.88888888888890
149,half-true,On the pace that we're on with job creation in the last four months ...we will have created more jobs in this year than in the entire Bush Presidency.,121.5
150,half-true,"Low-flow toilets can cost homeowners up to $1,000 each.",45.0
151,half-true,Every president since Franklin Delano Roosevelt has had fast-track trade authority.,65.6
152,half-true,The majority of Americans are conservatives.,42.8
153,half-true,Obama has racked up more debt than any president in history over $5 trillion.,59.111111111111100
154,half-true,Sarah Palin Says Arizona congressional candidate Ray Strauss is a Champion of Big Government for his votes to raise taxes while on the local city council.,121.0
155,half-true,With Gov. Chris Christie and bipartisan reformers New Jersey had the most job growth in 11 years.,75.5
156,half-true,"One-half of undocumented workers pay federal income taxes, which means they are paying more federal income taxes than Donald Trump pays.",104.77777777777800
157,half-true,"Weve got a 1,000 National Guard troop request thats been in front of this president for over a year and no response.",91.22222222222220
158,half-true,"In 67 different ways, Governor McCrory has raised taxes on middle income families.",61.0
159,half-true,"We spend more money on health care per capita in the United States than any other country in the world. Of the 30 developed countries in the world, we spend 2 1/2 times more than the average. Of the country that spends the second most per capita, Switzerland, we spend 175 percent more.",248.8
160,half-true,David Perdue said hed raise taxes.,36.5
161,half-true,"Randy Forbes SaysVirginia RepublicanScott Taylor has been convicted in at least four different courts across the country, at times failing to even appear, and having a warrant issued for his arrest.",171.11111111111100
162,half-true,"Savings that I achieved helped fund cameras on the border. As a result, more than 21,500 arrests have been made and 46 tons of narcotics confiscated.",128.375
163,half-true,"There's more than 100,000 people working at the Department of Agriculture. That's 1 employee for every 30 farmers.",88.44444444444440
164,half-true,"The amount of debt is on pace to double in five years and triple in 10. The federal debt is now over $100,000 per household.",103.4
165,half-true,"The minute this proposal for near-beach oil drilling came up, I was against it.",63.2
166,half-true,The proposed Gogebic mine in northern Wisconsin could be extended as long as 21 miles.,61.142857142857100
167,half-true,Paul Ryan tried to change the whole game for Social Security,48.111111111111100
168,half-true,Not one tax has been raised since Ive been governor.,44.5
169,half-true,The average American is working through the month of May just to pay off the government.,68.7
170,half-true,Americans Responsible Solutions Says Kelly Ayotte stands with the Washington gun lobby. They fund her campaigns.,87.75
171,half-true,"Barack Obama's network of small donors constitutes a ""parallel public financing system.""",67.55555555555560
172,half-true,"While the countrys economy was battered, nine states with no income tax actually grew jobs from 2001 to 2010.",84.6
173,half-true,"I can put 10,000 people to work. Electricians, plumbers, sheet metal workers -- by retrofitting all of the state buildings for energy independence or efficiency.",134.0
174,half-true,"She (Kagan) took money from Goldman Sachs just like her boss, Obama.",54.111111111111100
175,half-true,"When asked about equal pay for women, (Rubios) quote was that it was a waste of time.",63.3
