,claim_veracity,claim,leven__score
745,half-true,"Alison Alter has exploited a campaign finance loophole to obtain over $64,000 in public dollars to fund her campaign.",97.3
746,half-true,Thom Tillis has cut $500 million from public education.,41.625
747,half-true,Puerto Ricos $70 billion debt is unsustainable and it is unpayable. And the reason why it is unsustainable has everything to do with the greed of Wall Street vulture funds.,142.88888888888900
748,half-true,"The United States has the highest incarceration rate in the world with 2.3 million inmates, and the majority of Americans are imprisoned because they sold small amounts of drugs.",140.44444444444400
749,half-true,"Thanks to restrictive and anticompetitive ballot laws, candidates in November 2014 ran unopposed in nearly half of Wisconsins state representative races but in Michigan and Minnesota nearly all races had challengers.",185.0
750,half-true,"This week liberal Bill White faced an ethics complaint about more than $83,000 he failed to report to the state Ethics Commission.",110.55555555555600
751,half-true,"In Congress, (Cresent Hardy) voted to defund DACA.",43.5
752,half-true,Rhode Island has the highest dropout rate in New England at twenty-three percent.,60.5
753,half-true,"The Pentagons survey about the Dont Ask, Dont Tell policy found that 92 percent of service members agree that they could serve ... in a unit in combat without compromising mission readiness.",160.33333333333300
754,half-true,"Ben Carson is running for president to eliminate dependency on government. But he doesnt mention that he grew up in public schools, got public housing and food stamps, got free glasses from a government program, was helped by Affirmative Action, and got Pell Grants for college.",245.22222222222200
755,half-true,On his support for Donald Trump.,40.1
756,half-true,Barack Obamas recess appointment of Richard Cordray is precisely what then-Sen. Obama claimed would be the wrong thing to do.,100.66666666666700
757,half-true,Sotomayor has had her rulings thrown out by the court a troubling four times.,60.125
758,half-true,"Current projections indicate that Medicare will go bankrupt by 2017, while Social Security will bottom out by 2037.",93.0
759,half-true,The first installment of health care reform ... will raise the deficit by $250 billion.,66.55555555555560
760,half-true,On tax breaks for businesses,31.9
761,half-true,Greg Abbott was charged with overseeing the state cancer research fund. But he let his wealthiest donors take tens of millions of taxpayer dollars without proper oversight. They showered Abbott with gifts and free vacations.,194.33333333333300
762,half-true,"As speaker, Gingrich even supported taxpayer funding of some abortions.",53.77777777777780
763,half-true,It has been 80 years since a Supreme Court vacancy was nominated and confirmed in an election year. There is a long tradition that you dont do this in an election year.,133.875
764,half-true,"Every time somebody new gets the Ebola virus, it mutates.",45.9
765,half-true,George LeMieux voted against the majority of Republicans and joined with Democrats to create a Task Force For Responsible Fiscal Action that looks strikingly similar to the Super Committee now being set up in Washington to justify massive tax hikes.,215.14285714285700
766,half-true,"The Democratic health care bill will ""collect higher taxes for 10 years and provide health care for only six years.""",87.2
767,half-true,"A new manufacturing plant is slated to create about 3,000 jobs in central and northeast Georgia and create about a $3 billion infusion into the economy.",129.55555555555600
768,half-true,"You've got a building in the Cayman Islands that supposedly houses 12,000 corporations. That's either the biggest building or the biggest tax scam on record.",126.55555555555600
769,half-true,"Michael Bennet votes for President Obamas agenda 98 percent of the time. Hardly independent, hardly bipartisan.",89.44444444444440
770,half-true,"If you're over 65 years old in America today, you have no choice but to be in Medicare. Even if you want out of Medicare, you have to forfeit your Social Security to get out of it.",144.375
771,half-true,"Although we have twice the population of Greece, the state of Florida employs three times fewer government employees.",95.33333333333330
772,half-true,"We are the poster child for compliance, and whenever we discover possible infractions we resolve and report it to the NCAA no matter how minor the violations.",124.75
773,half-true,Rick Santorum Says he has been able to attract independents and Democrats to win elections in Pennsylvania.,81.0
774,half-true,"Families are paying $900, on average, ""in higher premiums because of uncompensated care.""",70.77777777777780
775,half-true,"The city of Brookhavens ordinance could cause the Pink Pony to close, thereby putting 300 Pink Pony employees out of work in this economy.",111.22222222222200
776,half-true,"In Washington, D.C., Sen. Richard Burr took millions from special interests, went there and cashed in, voted to cut (his) own taxes and raise taxes on working folks.",142.0
777,half-true,On whether judges should be allowed to place children with gay couples who wish to adopt.,68.6
778,half-true,Unemployment rate dropped in every state that elected a Republican gov. in 2010,55.2
779,half-true,State Rep. Kathleen Peters has a 100 percent pro-abortion voting record even voting against a ban on sex-selection abortions.,105.125
780,half-true,Barack Obama Says he passed a bill to stop a military requirement that wounded soldiers pay for meals and phone calls.,95.44444444444440
781,half-true,"This generation, on average, is starting their careers, if theyve been to a four-year college, with just under $30,000 in debt.",100.66666666666700
782,half-true,Our tax code is so complicated it extracts $140 billion in extra tax preparation costs every year - one thousand dollars for every American family.,123.8
783,half-true,"...some of those (tax increases) were either court-ordered, or they were voted on by the people and approved by the people for (such) things as roads.",125.7
784,half-true,Secular Americans are the fastest-growing religious identification demographic in this country.,69.77777777777780
785,half-true,"Our countrys got this huge debt, and (President Barack) Obama says raise taxes and keep spending more.",79.1
786,half-true,"Because of Obamacare peoples premiums ...are going up 35, 45, 55 percent.",57.7
787,half-true,Joe Garcia voted to raise our utility rates.,37.0
788,half-true,"Since Sherrod Brown and the Democrats rammed the economic stimulus bill through, Ohios unemployment rate has risen to 9.6 percent, above the national average.",133.75
789,half-true,President Barack Obama has announced that he would not sign ANY spending bills this year unless sequestration spending cuts are eliminated.,109.25
790,half-true,Oil production from federal waters in the Gulf of Mexico reached an all-time high in 2010.,67.5
791,half-true,"When Bernie Sanders was in college, Sanders said something very similar to what conservative Wisconsin Supreme Court Justice Rebecca Bradley had written as a college student in the 1990s -- that women have a legitimate role in date rape.",202.57142857142900
792,half-true,"Ted Cruz Says he has repeatedly praised Chuck Hagels character, patriotism, bravery, and personal service defending our nation.",102.25
793,half-true,The vast majority of our public school students are receiving less state support than their private voucher peers.,90.0
794,half-true,U.S. Senate opponent Eric Hovde supported billions in stimulus for high-speed rail and billions more to bail out banks.,100.25
795,half-true,The ocean is now much more acidic . . . than it has been for many millions of years.,62.3
796,half-true,Less than 1 percent of all the education dollars that we spend are spent on private (school) voucher programs.,88.9
797,half-true,"In some states, African-Americans are three times more likely to be sentenced to death than whites for the same crime.",93.375
798,half-true,"Seventy bills [Kendrick Meek] authored, not one of them has passed.",53.333333333333300
799,half-true,"In Florida, for eight years we cut taxes every year, totaling $19 billion.",57.8
800,half-true,I fought to bring about the largest private-sector infrastructure project in North American history.,75.5
801,half-true,"After Arizona banned smoking in all public places in 2007, admissions for acute myocardial infarction stroke, asthma, [and] angina decreased following the implementation of the ban.",143.3
802,half-true,"We had 2 percent of the global market (for advanced batteries) when he (Obama) started. We now have 16 percent, headed to 40 percent by 2015.",116.33333333333300
803,half-true,"About 100,000 kids in this country leave their home state and go to another state to be educated. Out of that 100,000 young people, 30,000 of them are from New Jersey, by far the largest amount.",170.0
804,half-true,Alabamians havent changed their opinion on same-sex marriage since voting to ban it in 2006.,69.75
805,half-true,"U.S. Sen. Ron Johnson opposes faster broadband internet in small towns and got nearly $90,000 in campaign contributions from the telecom special interests.",132.25
806,half-true,Texas legislation would allow teachers to kill their students if they felt it was needed.,63.8
807,half-true,Every poll said I won the debate.,37.666666666666700
808,half-true,"The Greenlight Pinellas 1-cent sales tax is permanent, we never get to vote on this again.",71.33333333333330
809,half-true,"Texas added 6,600 miles of highway from 2001-2012, more than any other state.",61.4
810,half-true,"Wrote that in 2006, Nancy Pelosi said she didnt think capturing Osama bin Laden makes us any safer, but in 2011 called his killing historic.",117.0
811,half-true,"Obama ""voted for ... $3-million for an overhead projector at a planetarium in Chicago.""",67.5
812,half-true,Undocumented immigrantspay $12 billion a year into Social Security.,37.4
813,half-true,"Miami-Dade mayoral candidate Julio Robaina has the highest salary among Florida mayors. More than $260,000.",82.5
814,half-true,"Since 2000, Texas has reduced harmful pollutants in the air like nitrogen oxide by 62.5 percent, and ozone by 23 percent--a reduction that is 12 percent greater than the national average.",157.125
815,half-true,"Gwinnett Medical Center is operating in the negative, in part, because of illegal immigrants.",72.75
816,half-true,Ron Johnson said specifically that he hopes the first steps occur to privatize the Veterans Administration.,89.0
817,half-true,"Republicans control the U.S. Senate with 54 seats, but those 54 senators were elected by only two-thirds the number of voters who elected the Democrats. In the Senate, the majority party represents a minority of the people.",192.71428571428600
818,half-true,"Under the presidents plan, he cuts Medicare by $716 billion, takes that money out of the Medicare trust fund and uses it to pay for Obamacare.",112.9
819,half-true,"The U.S. State Department has ordered 160,000 Hazmat suits for Ebola, prompting concerns that the federal government is anticipating the rapid spread of the virus.",133.2
820,half-true,Republicans fought to protect tax loopholes for corporations that send our jobs overseas.,57.1
821,half-true,"The average Ohio student graduates from a four-year college or university with nearly $27,000 in tuition debt.",82.6
822,half-true,"The U.S. had the opportunity with Israel coming and talking to us about improving our security screening procedures, and we turned them down.",114.6
823,half-true,Not one penny of (Californias Prop 67) bag ban tax goes to the environment.,57.2
824,half-true,"In campaigns in the past with Sen. McCain and President George W. Bush and others, they have tended to release tax records in April.",111.44444444444400
825,half-true,The stimulus program cut taxes for 95 percent of the American people.,53.5
826,half-true,Cw Bill Young Says he opposed $716 billion cut to Medicare.,48.22222222222220
827,half-true,President Obama helped more than half a million veterans and military family members go to college through the Post-9/11 G.I. Bill.,108.25
828,half-true,"In our proposal, we would have expanded school aid across the board Governor Christie slashed school aid in this budget, preferring instead to extend a tax break for millionaires over funding in the classroom.",178.1
829,half-true,"If todays economy was rebounding at the rate of the Reagan recovery, it would have created the equivalent of 25 million new jobs and raised federal revenue by $800 billion a year.",153.22222222222200
830,half-true,"When I was mayor of New York City, I encouraged adoptions. Adoptions went up 65-70 percent. Abortions went down 16 percent.",101.22222222222200
831,half-true,"John Oxendine is under a state ethics investigation because he illegally funneled more than $120,000 to his campaign from shady insurance political action committees in Alabama.",150.77777777777800
832,half-true,"Because of Texas lawmakers choices, hundreds of thousands of women no longer have access to basic medical care, life-saving cancer screenings and contraception.",133.9
833,half-true,"Obama has never submitted a budget, and Congress has worked for two years without passing one.",73.22222222222220
834,half-true,"Austins Stop Abuse for Everyone has seen in its offices sexual assault survivors that report being attacked by their ridesharing drivers, at a rate of one per month.",134.77777777777800
835,half-true,Thousands (in China) owe their jobs to Mitt Romneys companies.,52.333333333333300
836,half-true,"According to the Congressional Budget Office, as many as 20 million Americans could lose their employer-based insurance thanks to Obamacare.",111.22222222222200
837,half-true,"After merging with Tim Hortons of Canada, Burger King is not moving. Our headquarters will remain in Miami and (we) will continue to pay all of our federal, state and local U.S. taxes.",147.6
838,half-true,"Per-student K-12 state funding for Portland Public Schools has dipped from $6,036 in the 2007-2008 school year to $5,644 in the 2010-2011 school year",121.44444444444400
839,half-true,"Mitt Romney and George Allen would overturn Roe v. Wade and allow states to end safe, legal abortion even in cases of rape, incest or when a womans life is at risk.",141.88888888888900
840,half-true,"In Wisconsin, 6.2 percent of the population is black yet 24 percent of all state abortions are on African-Americans.",92.71428571428570
841,half-true,"Fred's never had a 100 percent record on right-to-life in his Senate career. The records reflect that. And he doesn't support the human life amendment, which is most amazing because that's been a part of the Republican platform since 1980.",212.55555555555600
842,half-true,"In 1928 school boards sent home letters with children saying that if Al Smith is elected president, you will not be allowed to have or read a Bible.",122.5
843,half-true,Mexico receives approximately $24 billion a year in remittances from Mexican nationals working in the United States. The majority of that amount comes from illegal aliens.,138.77777777777800
844,half-true,DeKalb County has been recognized in recent years as having one the best sheriffs departments in the nation.,86.22222222222220
845,half-true,"Between 2000 and 2010, the illegal immigrant population of Texas increased by 60 percent, while California and Florida had no increase.",103.25
846,half-true,"Sen. Obama ""made the very argument he is now criticizing back in November 2006.""",65.375
847,half-true,"Under Mitt Romney, 89 million Americans could be denied coverage if they have a pre-existing condition.",78.125
848,half-true,"The Medicare drug program resulted in the program coming in 40 percent under budget. ... And the reason it was, is because the design was right.",114.25
849,half-true,"Mary Nolan Says more than 8,000 people have supported her campaign as volunteers, donors and advisors and endorsers.",92.25
850,half-true,Rick Santorum reformed welfare.,32.888888888888900
851,half-true,Right now every single one of the (oil) companies here today and dozens of others are drilling for free in the Gulf of Mexico on leases that will cost American taxpayers more than $50 billion in lost royalties.,175.4
852,half-true,"President Barack Obamasown administration has done five environmental impact assessments of the Keystone XL pipeline, all of which have said it would have a minimum impact on the environment.",153.1
853,half-true,"Every time we put a ballot issue on, it costs a million dollars.",51.0
854,half-true,"Cuts in local government and school funding in John Kasichs budget caused many communities to seek school levies, local tax increases, layoffs.",115.875
855,half-true,A new Republican litmus test would have resulted in (the GOP) kicking out Ronald Reagan.,67.88888888888890
856,half-true,"Under Gov. John Kasichs budget proposal, the top one percent in Ohio will pay $10,000 less in income tax each year, but Ohios working and middle class families will pay more.",150.875
857,half-true,The Treaty of Tripoli signed by President John Adams was his outreach to Muslims.,58.4
858,half-true,"More than 40,000 troops are still stationed in Afghanistan with no clear objective. Even in the best case, by the end of the year at least 10,000 American soldiers will still be on the ground.",158.9
859,half-true,Many of the great scholars say that anchor babies are not covered by the 14th Amendment.,66.1
860,half-true,"Rural schools ""face the highest dropout rates, the lowest college enrollment rates, have the lowest average teacher salaries...""",104.0
861,half-true,Mike Gallaghers plan would cut Social Security benefits for two-thirds of seniors.,63.36363636363640
862,half-true,"While Act 10 allowed (Milwaukee County) to save some money, it was millions short of what we needed to fill the hole left by the $28 million cut in state aid.",132.66666666666700
863,half-true,21-million Americans could have a four-year college scholarship for the money we've squandered in Iraq. 7.6-million teachers could have been hired last year if we weren't squandering this money.,165.77777777777800
864,half-true,"Under the Obama administration, we are drilling and producing more domestic energy supplies than we ever had before.",90.33333333333330
865,half-true,"After a federal inquiry corroborated Hillary Clinton on Whitewater, the next day, there was nothing in the media about it.",93.88888888888890
866,half-true,"Hillary Clinton wants to ""wave the white flag of surrender and set a date for withdrawal.""",70.375
867,half-true,"All members of Congress are required to be in Obamacare, but Obama and members of his administration have their own gold-plated health care plans that theyre in.",131.4
868,half-true,"Average families are spending roughly $2,000 more a year on energy costs. ... It's like a $2,000 energy tax in just the last seven years, more than three times what the typical American family received from the Bush tax cuts.",196.33333333333300
869,half-true,"If we increase fuel efficiency standards to 40, 45 miles a gallon, we would have to import zero oil from the Middle East.",97.75
870,half-true,New Mexico is the second Hollywood because of tax incentives for the film industry.,63.6
871,half-true,"The United States doesnt have the highest murder rate among developed countries. You look at Russia, you look at Brazil, those are countries that have 3 to 5 times higher murder rates than what we have here in the United States.",193.7
872,half-true,"The Obama administration willfully leaked the existence of STUXNET (a computer worm used against Iran), allowing our enemies to learn more of our secrets and of our operations.",145.0
873,half-true,On transportation financing,33.77777777777780
874,half-true,PolitiFact Texas gave a David Dewhurst TV ad a Pants-on-Fire rating as an outrageous lie.,69.3
875,half-true,Smog was invented in Los Angeles. It was. The name was invented. There was a fellow at Caltech and he came up with the idea and they called it smog.,120.22222222222200
876,half-true,380 Americans have been killed in 294 mass shootings in 2015 alone.,49.5
877,half-true,Atlanta Tea Party co-founder Debbie Dooley wants gas taxes raised.,43.333333333333300
878,half-true,"As a result of welfare reform, poverty levels went down to the lowest level ever for ... African-American children.",92.2
879,half-true,John Mica's brother is an oil lobbyist and his daughter represents the natural gas industry.,75.625
880,half-true,Attorney General Eric Holders own Justice Department precleared the voting changes in the 2011 law about early voting in Florida.,105.33333333333300
881,half-true,"The city of Nelson, Ga., is quieter than Mayberry.",46.111111111111100
882,half-true,"Chris Christie fired 6,000 teachers.",38.6
883,half-true,"Currently, it takes up to 25 years to obtain U.S. citizenship legally but the Senate bill would allow immigrants who came to the United States illegally to obtain citizenship in just 13 years.",157.5
884,half-true,"Homeopathy, acupuncture and aromatherapy have been given elevated legitimacy under the Affordable Care Act.",84.5
885,half-true,Will Hurd cosponsored a bill that would militarize our border and allow 200 miles of new roads to be built in the Big Bend region -- cutting up our beloved park.,137.11111111111100
886,half-true,We are overcharging students . . . to help pay for the health care law.,55.0
887,half-true,Ellen Rosenblum has said over and over again that this is a job where 80 percent of the job is being the governments lawyer.,101.55555555555600
888,half-true,More than three-quarters of the oil is gone.,42.5
889,half-true,Marshawn Lynch is second all-time in terms of average yards per rush only to Terrell Davis.,70.88888888888890
890,half-true,"When housing and transportation costs are combined, Atlantas cost of living -- typically perceived as relatively low -- ranks as 7th worst out of 51 metros nationally.",142.0
891,half-true,"Over the last 10 years, Georgias public health has declined.",47.55555555555560
892,half-true,"At his fathers bank, Alexi made tens of millions in risky loans to convicted mobsters. Then, the bank collapsed.",86.55555555555560
893,half-true,Every year there is a slightly smaller percentage of American households owning guns.,60.875
894,half-true,A World Health Organization report shows that more people are dying of TB.,58.18181818181820
895,half-true,"More than a quarter of mortgage borrowers are underwater, and 11 percent of all homes are vacant.",70.0
896,half-true,"Twenty four states have voter ID or comparable restrictions; before Barack Obama was elected, it was two.",82.0
897,half-true,On timing of right to work legislation,37.75
898,half-true,About 22 percent of adults in Rhode Island and approximately 30 percent of youth (ages 10-17) are considered obese.,91.5
899,half-true,The number of killings of citizens by police is at a two-decade high.,53.4
900,half-true,"A new Rasmussen poll shows people ""oppose (Sotomayor's) confirmation. Only 37 percent support it.""",76.33333333333330
901,half-true,President Barack Obama (is) the first president in history to cut Medicare by $700 billion.,67.625
902,half-true,"Scientists predict sometime in the future, an event that will kill somewhere between 80 and 90 million people.",87.1
903,half-true,Missouri needs a voter I.D. law because theres over 16 people in the state of Missouri who have been convicted of some type of voter fraud.,114.33333333333300
904,half-true,"Since the Fed was created in 1913, the U.S. Dollar has lost 98% of its purchasing power.",66.8
905,half-true,"Milwaukee blacks have 55 percent male unemployment, 60 percent truancy, a 50 percent graduation rate, the worst reading scores and lead in infant mortality.",132.75
906,half-true,"The health care law was a 2,733-page bill! . . . No amendments!",52.25
907,half-true,"The Obama administration estimates the number of children at the border is going to increase to 150,000 to 200,000 next year.",104.6
908,half-true,Regime change (in Iraq) took eight years,38.888888888888900
909,half-true,We spend $18 billion a year on making sure that the federal government has immigrant enforcement agents. Thats more than DEA and the ATF and the FBI and all the other enforcement (agencies) combined.,170.375
910,half-true,"Lyme disease is one of the fastest growing infectious diseases in the United States, and Rhode Island has the second-highest incidence of this disease in the country.",135.3
911,half-true,There are still more people uninsured today than when Obama was elected president.,61.22222222222220
912,half-true,Illegal aliens are costing Georgia taxpayers over a billion dollars every year.,61.3
913,half-true,There are 3 million jobs available in America that are not filled because too many of our people dont have the skills for those jobs.,101.7
914,half-true,President Obama has said he is going to cut veterans benefits.,43.875
915,half-true,Scott Walker is forcing some women to undergo a transvaginal probe to get an abortion.,61.111111111111100
916,half-true,"9-year-old girl was recently raped in Austin, Texas, by a guy previously caught four times and released.",82.1
917,half-true,"In a period of roughly 72 hours, a small group of angry black students managed to force the resignation of the two highest ranking officials at that school.",132.66666666666700
918,half-true,"By 2014, there will be one administrator for every teacher on college campuses in the United States.",82.6
