,claim_veracity,claim,leven__score
1858,half-true,Expanding Medicaid would create 63k jobs.,39.3
1859,half-true,Florida is considered the fourth-largest gambling state in the nation.,52.111111111111100
1860,half-true,Secretary of State Jon Husted and former secretary Jennifer Brunner both have supported a provision in Senate Bill 47 that would limit the days organizers have to collect signatures for initiative and referendum petitions.,201.11111111111100
1861,half-true,"When Mitt Romney was governor, Massachusetts ... (had) more debt per person than any other state in the country.",86.1
1862,half-true,Mitt Romney put Planned Parenthood on a state medical board but failed to put a pro-life group on the same board.,88.44444444444440
1863,half-true,"Housing prices dropped for the 30 months prior to Barack Obama taking office, and they have stabilized, theyve been about flat since the president came in.",128.33333333333300
1864,half-true,"Passage of Clinton budget bill in 1993 ""led to an enormous flowering of the economy in America.""",70.6
1865,half-true,Compact fluorescent light bulbs are toxic and not environmentally friendly.,49.6
1866,half-true,"Ohio is probably top five in the country, sadly, in terms of heroin overdoses. Its now exceeded car accidents as the No. 1 cause of death in Ohio.",120.3
1867,half-true,The home-mortgage deduction is widely thought to be a middle-class benefit. Its not -- 73 percent of it goes to people making a quarter-million dollars or more a year.,142.6
1868,half-true,Most of the black scientists in this country dont come from schools like the University of Texas. They come from lesser schools.,100.2
1869,half-true,"Bill McCollum ""cost the rest of us billions"" as a member of Congress, including a national debt that ""skyrocketed"" to $4.7 trillion.",113.0
1870,half-true,Thomas Jefferson created the Marines for the Islamic pirates that were happening.,59.3
1871,half-true,Our whole food system in this country...most of it is genetically engineered. And (there is) no testing for the health consequences of this food.,117.25
1872,half-true,To say a family has to buy a product from a private company is clearly beyond the delegated powers of the U.S. Constitution.,104.0
1873,half-true,"I vetoed more than $3 billion in spending. Lawmakers and I cut taxes for 40,000 small businesses. Now Texas is No. 1 in job creation. The nations five best housing markets are right here in Texas. We balanced five state budgets and we cut state spending.",220.0
1874,half-true,Signs posted at projects funded by the federal stimulus act has cost 20 or 40 million dollars.,74.5
1875,half-true,"If the debt ceiling is surpassed, our nation will not go into default as some suggest.",61.9
1876,half-true,Taking the Fifth Amendment in a deposition about the Columbia/HCA hospital chain he founded means a truthful answer to the questions that (Rick Scott) was asked would incriminate him.,152.0
1877,half-true,"When Mitt Romney was governor, Massachusetts was 47th in job creation",48.4
1878,half-true,One in three American women will have had an abortion by the time she reaches the age of 45.,69.7
1879,half-true,"From 1960, the year I was born, until the time I became Governor in 2003, the average two-year increase in Minnesota state spending was 21 percent. we brought that down dramatically, to about 1.7 percent per year.",183.85714285714300
1880,half-true,You would receive a citation for taking a dildo to class at the University of Texas.,61.0
1881,half-true,Weve seen more manufacturing jobs created since Ive been president than anytime since the 1990s. Thats a fact.,85.22222222222220
1882,half-true,Senate Minority Leader Mitch McConnell has blocked the Senate over 400 times.,49.333333333333300
1883,half-true,Virginia saved $300 million by rebidding a Metrorail construction project to exclude guaranteed union contracts.,87.9
1884,half-true,"You worked hard for your money and you paid your taxes when you earned it. Now, (Indiana Republican congressional candidate) Todd Young wants to tax it again when you spend it.",156.11111111111100
1885,half-true,Florida election officials requests to some residents to submit proof of citizenship is a backdoor poll tax.,84.44444444444440
1886,half-true,"Even after Syrian troops began to shoot protesters in the streets with live ammunition in 2011, Clinton labeled Bashar al-Assad a reformer.",111.33333333333300
1887,half-true,There are 500 registered Republicans moving to Texas every day.,50.111111111111100
1888,half-true,An arts tax would provide funding for certified arts and music teachers for every elementary school serving Portland residents.,97.5
1889,half-true,"Every year the average woman loses around $11,000 to the wage gap, which amounts to a $500,000 vagina tax over her working career.",100.3
1890,half-true,Peter DeFazio votes with Nancy Pelosi 86 percent of the time.,45.875
1891,half-true,America never made up for the gutting of the intelligence services that Bill Clinton did. I think those are (former CIA director George) Tenet's words ... that Bill Clinton gutted American intelligence.,179.9
1892,half-true,This governor has given us continual balanced budgets without raising taxes.,56.888888888888900
1893,half-true,"Weve accomplished balancing two budgets without raising taxes. Weve now created 60,000 new private-sector jobs. Weve made government smaller.",115.125
1894,half-true,The U.S. borrows 42 cents of every dollar Washington spends today and about half of that comes from countries like China.,97.375
1895,half-true,"Her health care plan will cost $110-billion in the first year, which can be paid for with savings.",80.0
1896,half-true,"Georgia has lost 14 percent of its jobs paying more than $50,000 a year and added 15 percent to its Medicaid rolls during the recovery.",115.25
1897,half-true,The Orlando shooter used a weapon of war.,40.6
1898,half-true,We [the city of Atlanta] are overbuilt on housing.,44.22222222222220
1899,half-true,"New Jersey lost private-sector jobs between 2000 and 2009 because Democrats increased taxes, fees, regulations and state spending.",105.0
1900,half-true,The Obama administrations policies have reduced minority dropout rate by 25 percent.,62.888888888888900
1901,half-true,Chris Christie Says his administration balanced two budgets with over $13 billion in deficits without raising taxes.,92.3
1902,half-true,"Thanks to our policies, for the first time in state history, we have put millions of dollars into our rainy day fund in consecutive years.",110.77777777777800
1903,half-true,Lois Frankel took a 40 percent pay raise as mayor while West Palm Beach lost jobs.,66.85714285714290
1904,half-true,GOP Congressional candidate Scott Jones wants to build a wall. He wants to round people up and deport folks.,83.9
1905,half-true,"Since I took office in January 2011, we have created 11,100 Rhode Island-based jobs.",68.0
1906,half-true,Sen. McConnell says its not his job to bring jobs to Kentucky.,46.77777777777780
1907,half-true,One out of four of our young people say they are victims of this (dating) violence.,66.44444444444440
1908,half-true,"Because of union rules, cooks helpers moved into DMV jobs they were not trained for",67.66666666666670
1909,half-true,"U.S. Sen. Ron Johnson wants to put 100,000 troops, including 25,000 Americans, into the area where ISIS is.",80.25
1910,half-true,Rick Boucher helped write the cap-and-trade bill,38.77777777777780
1911,half-true,Let's not blame President Bush for all of this. We've got a Congress who sat around on their hands and done nothing but spend a lot of money ... leaving us $9-trillion in debt that we're passing on to our grandchildren.,195.11111111111100
1912,half-true,The states that actually have lots of teachers in teacher unions tend to be the states that have done the best in terms of academic success in this country.,125.4
1913,half-true,Gov. Bob McDonnell in 2010 did not even create enough jobs to keep pace with population growth in Virginia.,84.55555555555560
1914,half-true,"Contrary to media reports, Georgias gas tax change led to no price increase at the pump.",66.66666666666670
1915,half-true,More than 25 million Americans are unemployed. More than 50 million live without health insurance. Perhaps 100 million live in poverty.,109.11111111111100
1916,half-true,Ronald Reagan was behind in the polls in 1980 going into the debate with Jimmy Carter and then turned around 10 days later and won 40 states.,111.11111111111100
1917,half-true,Hillary Clintons approval rating went from 70 percent to 52 percent in 18 months.,56.875
1918,half-true,"People buy more items during Georgias sales-tax holidays, boosting economic activity.",61.111111111111100
1919,half-true,Americans are working longer hours for low wages . . . and yet almost all new income and wealth is going to the top 1 percent.,100.55555555555600
1920,half-true,"McCain's ""plan for the economy is to extend George Bush's tax cuts for billionaires and give a $100-billion additional corporate tax cut.""",112.11111111111100
1921,half-true,Together we added more jobs than any other area while I was Dane County executive.,63.0
1922,half-true,The nuclear agreement with Iran never sunsets. Theres no sunset in this agreement.,58.8
1923,half-true,Julie Lassa willingly took a hefty pay raise at a time when people throughout her district and the state were losing their jobs.,102.25
1924,half-true,Richard Burr voted to protect tax breaks for companies that ship jobs overseas but voted against a tax break to help working people.,98.5
1925,half-true,Workers who pick produce in Georgias fields can make $12 to $18 an hour.,55.22222222222220
1926,half-true,There have been more than 300 mass shootings in the United States this year more than any other country in the world.,83.22222222222220
1927,half-true,"Under Obama, families have lost over $4,000 a year in income.",50.125
1928,half-true,Amazon has removed aneducational game about Gettysburg.,45.9
1929,half-true,"Gov. (Pat) McCrory took $500,000 directly out of the disaster relief fund. And you know what its for? House Bill 2.",93.77777777777780
1930,half-true,The unemployment rate among (the) non-college-educated is well into the double digits in America. Its 4 percent or 5 percent for people who have college degrees.,128.55555555555600
1931,half-true,"For every dollar we put in unemployment, it pays back about $1.60.",54.7
1932,half-true,95 percent of job creators say Wisconsin is headed in the right direction.,60.44444444444440
1933,half-true,Solyndrahad robots that whistled Disney songs. Im not kidding.,51.2
1934,half-true,Twenty million Americans are out of work.,35.0
1935,half-true,Theres $30 billion in expansion funds that weve paid its our money and Nathan Deal wants Washington to keep it.,87.3
1936,half-true,This is the first time in Texas history -- and only the fourth time in United States history -- that two women are running for the top spots.,116.57142857142900
1937,half-true,"Crist stays in $2,000 a night luxury hotel suites where he racks up $1,300 in mini-bar charges, and doesn't pay for a dime of it himself.",112.44444444444400
1938,half-true,Women make 77 cents for every dollar earned by men.,39.7
1939,half-true,"Under President Barack Obama, more Americans are in poverty ... than at any time since the Census Bureau began keeping records on it over 50 years ago.",122.0
1940,half-true,Every Florida teacher gets a pay raise.,40.81818181818180
1941,half-true,Austin is the only city in an arid landscape in the western United States dependent on a single source of water.,86.22222222222220
1942,half-true,"In 29 states in this country you can still get fired for not just being gay, but if your employer thinks you are gay.",83.11111111111110
1943,half-true,"When Marcy Kaptur brought home $42 million for new manufacturing jobs, Dennis Kucinich voted no.",74.33333333333330
1944,half-true,400 bills have my name on them either as a sponsor or a co-sponsor. You dont get that done unless you work with folks on the other side.,112.7
1945,half-true,Livable Damascus Says Steve Spinnett has court judgments against him for trespass and harassment.,73.5
1946,half-true,Barack Obama ended up getting re-elected by the largest gender gap in the history of American elections.,79.0
1947,half-true,Ronald Reagan talked about converting the United States to the metric system.,55.54545454545460
1948,half-true,The giant African land snail carries human meningitis.,40.7
1949,half-true,"Under sequestration, the military was cut down to the smallest Army since 1940, the smallest Navy since 1915.",85.1
1950,half-true,"The Republicans didn't have a budget in '02, '04, '06.",48.375
1951,half-true,Milwaukee has the highest incarceration rate among African-American men in the country.,61.3
1952,half-true,Republicans are now taking credit for provisions of the health care bill that they had tried to derail.,77.875
1953,half-true,"300,000 Floridians will lose their current health plans because of Obamacare, a plan Alex Sink supports.",79.8
1954,half-true,The immigration proposal from the Gang of Eight is not amnesty.,49.7
1955,half-true,The study of the Savannah River Estuary . . . clearly demonstrates the project can be constructed and [environmental] impacts will be mitigated.,113.55555555555600
1956,half-true,There has been a 100 percentincrease in student debt under this Democratic White House.,63.55555555555560
1957,half-true,New York Mayor Michael Bloomberg says we can only have three bullets and the NRA wants firearms with nukes on them.,86.8
1958,half-true,"If you look at any real analysis, the Trans-Pacific Partnership is going to generate better-paying jobs that are more stable.",90.55555555555560
1959,half-true,It costs more money to put a person on death row than it does to lock them up for the rest of their lives because of attorney fees.,102.6
1960,half-true,"Barack Obama supports plans to raise ""income taxes ... payroll taxes.""",54.8
1961,half-true,Over 20 percent of the electorate is Hispanic in Florida.,47.77777777777780
1962,half-true,"MittRomneys tax plans would give an additional $250,000 tax cut to millionaires and billionaires while raising taxes on the middle class.",109.25
1963,half-true,SaysGary Johnson and the Libertarian Party want to get rid of the public school system.,63.6
1964,half-true,There are more than twice as many (crisis pregnancy centers) as there are legitimate abortion providers in the United States.,94.2
1965,half-true,"Most illegal immigrants draw welfare benefits, theyre sending their kids to school, theyre using the public services.",94.7
1966,half-true,"When Colorado eased its medical marijuana laws, fatal accidents involving pot-using drivers soared while overall traffic fatalities decreased.",111.11111111111100
1967,half-true,"Several times in the last 15 years, Austin City Council candidates have won seats after trailing by more than 4,000 votes in the election prompting the runoff.",130.44444444444400
1968,half-true,"Seven times Obama could have stopped Chinas cheating. Seven times, he refused.",58.77777777777780
1969,half-true,"For educational testing, Florida has chosen a company that has a significant history of promoting identification of the GLBT lifestyle for children as young as seven years old.",147.55555555555600
1970,half-true,"When Charlie Crist was elected governor, Florida ranked 31st in K-12 education. ""Last year ... we went from 31st to 14. And this year, the top 10 in America.""",137.0
1971,half-true,25 percent of Austins public school buildings are underutilized.,52.625
1972,half-true,"Before Rick Perry became governor, only 4 percent of our total labor force was a minimum wage job ... Today, that number has more than doubled (to) 9.5 percent.",134.625
1973,half-true,"The transportation tax is regressive, and Emory University is literally getting its own transit line at virtually no cost to itself.",104.71428571428600
1974,half-true,"Richard Swett Says that in 2009, Jon Huntsman said that the Recovery Act wasnt large enough and as governor he asked for $14.4 billion in federal stimulus funds. Now hes saying that he never supported it.",176.4
1975,half-true,The United States isfighting with Iraqis to defeat ISIS along with Iran. But in Yemen were fighting Iran with Iraqis and Saudis.,102.8
1976,half-true,"Since February 2009, the private sector has lost millions of jobs while the federal government has grown by hundreds of thousands of workers.",114.7
1977,half-true,Oregons per capita income is 9 percent below the national average and getting worse. This is a state thats actually getting poorer.,102.0
1978,half-true,"Most of the people that work in finance make $70,000, $80,000 a year.",55.44444444444440
1979,half-true,Were already seeing bakers and florists and photographers forced to participate in same-sex marriages under the threat of law and in some cases even jail.,124.2
1980,half-true,Rhode Island is the last state still using the Optech III P voting machines and they dont meet suggested federal standards.,95.33333333333330
1981,half-true,"Obamacare cuts $500 billion in future Medicare funding in order to fund the new constitutionally questionable government mandate, even going so far as to scuttle Medicares most popular (and successful) part, Medicare Advantage.",195.55555555555600
1982,half-true,"Our Democracy 2020 Says an election clerk in Green Bay refused to allow early voting on the UW-Green Bay campus because she was afraid it would help Democrats, showing outrageous partisan bias.",162.6
1983,half-true,"The Baucus health care bill ""would drastically restrict the use of flexible spending accounts (FSAs) in order to help pay for health care reform.""",129.5
1984,half-true,"Zero Planned Parenthood facilities are licensed to do mammograms. Planned Parenthood, women dont need you!",79.25
1985,half-true,"Under the Obama administrations bailout of General Motors, Ohio dealerships were forced to close.",72.4
1986,half-true,"Tom Graves Says President Barack Obama has amended, delayed, or repealed 19 components of his very own (health care) law.",96.0
1987,half-true,"If Congress does not pass the renewal of the payroll tax cut before the end of the year, nearly 160 million working families will see their taxes go up by roughly $1,000.",148.9
1988,half-true,The governments twice the size it was 10 years ago. Its 30 percent bigger than it was when (Barack) Obama became president.,96.125
1989,half-true,President Barack Obama put in place historic fuel efficiency standards for cars and trucks to lower costs at the pump and reduce dependence on foreign oil.,124.55555555555600
1990,half-true,Charlie Crist signed into law an automatic 15 percent annual tuition increase that put college further out of reach for many Floridians.,104.66666666666700
1991,half-true,Romney and Ryan both backed proposals that would outlaw abortions even in cases of rape or incest.,76.22222222222220
1992,half-true,"Seventy-four percent of Rhode Islanders support [a] national popular vote [for president] because they, as I, believe in one person-one vote.",110.0
1993,half-true,The medical marijuana ballot initiative doesnt require a physician writing a prescription and can be for conditions like having a back that needs to be scratched.,134.2
1994,half-true,The United States still ranks 20th in the world in access to broadband -- over 50 percent below the best nations.,85.7
1995,half-true,"When union membership goes down, so do (middle class) wages.",45.888888888888900
1996,half-true,"The Democratic Congress has already taken significant steps to create jobs and jump-start the economy, resulting in the lowest tax rates in over 50 years and the creation of over 500,000 new jobs so far this year.",185.625
1997,half-true,Secretary of State A. Ralph Mollis wrongly takes credit for small-business program,64.75
1998,half-true,Our school test scores are right at the bottom.,42.0
1999,half-true,"There was a report that came out from the FBI a warning, not a report ... saying that, in fact, al-Qaida was planning to attack malls during the Christmas holidays.",142.33333333333300
2000,half-true,"29 mass shootings have been committed by concealed carriers since 2007, while during this period only one (1) licensed civilian meaningfully intervened in a mass shooting.",140.11111111111100
2001,half-true,Another great endorsement! Barrow Journal explains the difference between me and Jody Hice.,73.66666666666670
2002,half-true,"Charlie Crist was the only prominent Republican in the country to campaign with Barack Obama before the stimulus passed, on behalf of the stimulus.",124.75
2003,half-true,"If you like your health care plan, you can keep your health care plan.",47.25
2004,half-true,The idea of one casino per tribe is a false one.,38.0
2005,half-true,Senate Majority Pac Says Marco Rubio wanted to cut Social Security and Medicare because he said theyre bankrupting our country.,99.33333333333330
2006,half-true,"The FL Guard has defended our freedom in Afghanistan, Iraq, and put their lives at risk; now the fed govt is going to cut their pay 20%.",113.9
2007,half-true,"My opponent here has accepted money from Freddie Mac, Fannie Mae (and) hosted subprime mortgage seminars.",77.33333333333330
2008,half-true,"The labor market is weak because if you count the unemployed, underemployed, and those whove stopped looking for work, the unemployment rate actually went up last month to 13.5 percent.",152.11111111111100
2009,half-true,"Just like the U.S. Chamber of Commerce, the AFL-CIO receives dues from foreign entities associated with it.",87.8
2010,half-true,"Obama opposes lower gas taxes, nuclear power, new offshore drilling and doesn't have ""new solutions"" to the energy crisis.",99.88888888888890
2011,half-true,Bernie Sanders fundamentally changed the lives of Immokalee farm workers in Florida for the better.,73.88888888888890
2012,half-true,David Sewell Says he never donates to Democrats while Paul Workman contributes to Democrat Kirk Watson and other Democrats running against Republicans.,131.625
2013,half-true,"Hospitals have already begun layoffs, a direct result of Republican inaction on Medicaid expansion.",76.75
2014,half-true,On whether the Iraq War was a mistake.,41.0
2015,half-true,On hearings about automatic citizenship provision in U.S. Constitution.,54.4
2016,half-true,"Of all the people in federal prison for possession of illegal substances, 77 percent of them are not citizens of the United States.",104.3
2017,half-true,Potential GOP U.S. Senate candidate Tommy Thompson supported Obamacare,55.111111111111100
2018,half-true,"The CBO just said if we cut this (unemployment benefits) extension, we will kill jobs, because those people who are looking for work wont have any money to spend.",133.6
2019,half-true,"Hank Johnson voted against legislation to help first responders, teachers, vets and troops.",68.625
2020,half-true,"In Texas, weve had three ISIS-related incidents already.",46.0
2021,half-true,"John McCain would ""reduce oversight of health insurance.""",52.333333333333300
2022,half-true,Proposed fast-track legislation allows presidents to easily use a future trade deal to override our domestic financial rules.,98.5
2023,half-true,Our government has spent $2.6 million to teach Chinese prostitutes how to drink responsibly.,57.9
2024,half-true,We havent had any legislation which took away one gun in the past 20 years from anybody in this country--not one.,91.0
2025,half-true,"There are about 120,000 solar energy jobs in the United States, but only 1,700 of them are in Georgia.",77.11111111111110
2026,half-true,"Its commercial vehicles, 18 wheelers and above that cause 90 plus percent of the damages on our highways and bridges.",95.66666666666670
2027,half-true,"After every major conflict ... what happened was that we ultimately hollowed out the force, largely by doing deep, across-the-board cuts.",109.55555555555600
2028,half-true,F: The grade given to Florida for college affordability under Jeb Bushs leadership.,64.55555555555560
2029,half-true,"Americans will spend more on taxes in 2014 than they will on food, clothing and housing combined.",56.54545454545460
2030,half-true,Gov. Scott Walker made more than $70 million in cuts to job training programs through (Wisconsins) technical colleges.,90.1
2031,half-true,John Faso took money from fossil fuel companies as they tried to take your land by eminent domain for a fracked gas pipeline.,100.6
2032,half-true,1 in 4 Rhode Islanders under the age of 65 does not have health insurance.,51.44444444444440
2033,half-true,Barack Obama Says Mitt Romneys comments indicated he would not have pursued Osama bin Laden.,66.5
2034,half-true,"As governor, Maggie Hassan first proposed a $1 billion spending increase.",55.375
2035,half-true,There are 500 failing schools in North Carolina,38.55555555555560
2036,half-true,"Bernie Sanders voted with Republicans to protect the Minutemen, a hate group that used military tactics against our community.",100.55555555555600
2037,half-true,"Since the governor took office, Oregons unemployment rate has dropped to its lowest point in three years.",82.75
2038,half-true,A Republican budget proposal would have Wisconsin have the weakest standards for who can be a teacher in the classroom in the country.,109.66666666666700
2039,half-true,Defensive medicine costs Georgia up to $14 billion a year.,48.111111111111100
2040,half-true,"Rhode Island will become just the second state to mandate the vaccine and the only state to do so by regulatory fiat, without public debate, and without consideration from the elected representatives of the people.",182.2
